{
  "trip": {
    "title": "夏日上海 · 三日浪漫历史之旅",
    "city": "上海",
    "dateStart": "7月21日",
    "dateEnd": "7月23日",
    "daysCount": 3,
    "stats": [
      {
        "value": "3 天",
        "label": "行程天数"
      },
      {
        "value": "13 个",
        "label": "计划地点"
      },
      {
        "value": "¥2,800",
        "label": "人均预算"
      },
      {
        "value": "12,000 步",
        "label": "预计日均步数"
      },
      {
        "value": "7月·夏季",
        "label": "出行季节"
      }
    ]
  },
  "days": [
    {
      "day": 1,
      "theme": "DAY 1 · 外滩源",
      "title": "外滩建筑群 · 南京路",
      "items": [
        {
          "time": "09:30",
          "poi": "上海体育大厦",
          "note": "上午光线好，适合拍摄历史建筑外观，且游客较少"
        },
        {
          "time": "11:00",
          "poi": "上海工人第三次武装起义发布命令地点",
          "note": "位于人民广场附近，与体育大厦步行可达，室内参观不受降雨影响"
        },
        {
          "time": "12:30",
          "poi": "南京路步行街",
          "note": "午餐时间逛步行街，商业氛围浓厚，可避雨逛街"
        },
        {
          "time": "15:00",
          "poi": "上海工商学联合会遗址",
          "note": "下午参观红色遗址，室内展陈为主，适合雨天安排"
        },
        {
          "time": "17:30",
          "poi": "上海外滩建筑群",
          "note": "傍晚日落时分（约19:00前）光线最佳，万国建筑群在金色余晖中格外浪漫，适合情侣拍照"
        }
      ],
      "eat": "南京路『老正兴菜馆』招牌红烧肉"
    },
    {
      "day": 2,
      "theme": "DAY 2 · 梧桐深处",
      "title": "武康路 · 交通大学 · 鲁迅故居",
      "items": [
        {
          "time": "09:00",
          "poi": "武康路",
          "note": "早晨游客少，梧桐树荫下漫步舒适，适合情侣拍照打卡"
        },
        {
          "time": "10:30",
          "poi": "上海交通大学早期建筑",
          "note": "校园历史建筑群，需在『上海交通大学』官方公众号预约入校参观，上午光线适合摄影"
        },
        {
          "time": "13:00",
          "poi": "上海市立图书馆（杨浦区图书馆）",
          "note": "下午室内参观，古典建筑与阅读空间，避雨又文艺；需在官方公众号预约入馆"
        },
        {
          "time": "15:30",
          "poi": "上海鲁迅故居",
          "note": "位于虹口区山阴路，需在『鲁迅纪念馆』官方公众号提前预约，室内参观不受天气影响"
        }
      ],
      "eat": "山阴路『万寿斋』鲜肉小笼包"
    },
    {
      "day": 3,
      "theme": "DAY 3 · 老城厢",
      "title": "豫园 · 大上海电影院",
      "items": [
        {
          "time": "09:00",
          "poi": "豫园",
          "note": "上午开园时段（8:30开园）游客最少，夏季凉爽，适合情侣漫步古典园林；需在『豫园』官方公众号提前购票，门票40元/人"
        },
        {
          "time": "11:30",
          "poi": "博文女校",
          "note": "位于老城厢区域，与豫园顺路，红色历史遗址，免费参观"
        },
        {
          "time": "14:00",
          "poi": "大上海电影院",
          "note": "下午观影避暑，历史建筑内的影院，可在大众点评或猫眼App提前购票选座，适合情侣约会"
        },
        {
          "time": "16:30",
          "poi": "上海总工会第四办事处旧址",
          "note": "位于黄浦区，与大上海电影院距离近，红色遗址免费参观，室内为主"
        }
      ],
      "eat": "豫园『南翔馒头店』蟹粉小笼"
    }
  ],
  "budget": [
    {
      "label": "餐饮",
      "amount": 900,
      "percent": 32
    },
    {
      "label": "门票",
      "amount": 300,
      "percent": 11
    },
    {
      "label": "交通",
      "amount": 400,
      "percent": 14
    },
    {
      "label": "住宿",
      "amount": 900,
      "percent": 32
    },
    {
      "label": "购物及其他",
      "amount": 300,
      "percent": 11
    }
  ],
  "checklist": [
    {
      "text": "身份证/学生证等有效证件",
      "done": false
    },
    {
      "text": "7月夏季折叠伞（预报有降雨，必备）",
      "done": false
    },
    {
      "text": "防晒霜 + 遮阳帽（7月夏季紫外线强）",
      "done": false
    },
    {
      "text": "豫园门票（提前在『豫园』官方公众号预约购票）",
      "done": false
    },
    {
      "text": "上海交通大学入校预约（在官方公众号提前申请）",
      "done": false
    },
    {
      "text": "上海市立图书馆入馆预约（官方公众号预约）",
      "done": false
    },
    {
      "text": "上海鲁迅故居预约（『鲁迅纪念馆』公众号预约）",
      "done": false
    },
    {
      "text": "大上海电影院电影票（猫眼/淘票票App提前购票）",
      "done": false
    },
    {
      "text": "舒适步行鞋（日均约12,000步）",
      "done": false
    },
    {
      "text": "充电宝+数据线（拍照打卡耗电快）",
      "done": false
    }
  ],
  "tips": [
    "🌧️ 7月夏季多降雨：建议随身携带折叠伞，下载『上海地铁』App或使用支付宝乘车码，雨天优先选择地铁出行，各站点间有地下通道可避雨",
    "📱 门票预约：豫园（40元/人）、上海交通大学、上海市立图书馆均需在各自官方公众号提前1-3天预约，暑期名额紧张建议尽早",
    "📸 外滩最佳拍摄时间：夏季日落约18:50-19:10，建议17:30前到达外滩占位，使用『Lightroom』或『醒图』App后期调色效果更佳",
    "🚇 交通建议：购买『上海地铁三日票』（45元/张，地铁站客服中心购买），3天内无限次乘坐，比单程票节省约60元",
    "🍜 用餐提示：南京路和豫园周边老字号餐厅（老正兴、南翔馒头店）午晚餐高峰需排队30-60分钟，建议11:00前或13:30后错峰用餐",
    "⚠️ 「上海工商学联合会遗址」未能在高德地图核实到在营状态，高德数据覆盖有限，建议出行前再确认"
  ],
  "schemaVersion": "1.0",
  "validation_report": {
    "poi": [
      {
        "name": "上海体育大厦",
        "status": "verified",
        "district": "松江区"
      },
      {
        "name": "上海工人第三次武装起义发布命令地点",
        "status": "verified",
        "district": "黄浦区"
      },
      {
        "name": "南京路步行街",
        "status": "verified",
        "district": "黄浦区"
      },
      {
        "name": "上海工商学联合会遗址",
        "status": "unknown",
        "note": "高德地图未核实到在营状态，建议出行前确认"
      },
      {
        "name": "上海外滩建筑群",
        "status": "unknown",
        "note": "高德地图未核实到在营状态，建议出行前确认"
      },
      {
        "name": "武康路",
        "status": "unknown",
        "note": "高德地图未核实到在营状态，建议出行前确认"
      },
      {
        "name": "上海交通大学早期建筑",
        "status": "unknown",
        "note": "高德地图未核实到在营状态，建议出行前确认"
      },
      {
        "name": "上海市立图书馆（杨浦区图书馆）",
        "status": "unknown",
        "note": "高德地图未核实到在营状态，建议出行前确认"
      },
      {
        "name": "上海鲁迅故居",
        "status": "unknown",
        "note": "高德地图未核实到在营状态，建议出行前确认"
      },
      {
        "name": "豫园",
        "status": "unknown",
        "note": "高德地图未核实到在营状态，建议出行前确认"
      },
      {
        "name": "博文女校",
        "status": "unknown",
        "note": "高德地图未核实到在营状态，建议出行前确认"
      },
      {
        "name": "大上海电影院",
        "status": "unknown",
        "note": "高德地图未核实到在营状态，建议出行前确认"
      },
      {
        "name": "上海总工会第四办事处旧址",
        "status": "unknown",
        "note": "高德地图未核实到在营状态，建议出行前确认"
      }
    ],
    "poi_verified": "3/13",
    "routes": [
      {
        "day": 1,
        "total_km": 34.4,
        "backtrack": false
      },
      {
        "day": 2,
        "total_km": 0,
        "backtrack": false
      },
      {
        "day": 3,
        "total_km": 0,
        "backtrack": false
      }
    ],
    "route_backtrack": false,
    "checked_at": "2026-07-21",
    "weather_fit": "poor",
    "weather_notes": [
      "第1天冰雹雷暴，仍有 5 个户外项目，建议准备雨具和室内备选",
      "第2天雷暴，仍有 3 个户外项目，建议准备雨具和室内备选",
      "第3天雷暴，仍有 4 个户外项目，建议准备雨具和室内备选"
    ]
  }
}