{
  "trip": {
    "title": "盛夏重庆 · 家庭慢游三日行程",
    "city": "重庆",
    "dateStart": "7月19日",
    "dateEnd": "7月21日",
    "daysCount": 3,
    "stats": [
      {
        "value": "3 天",
        "label": "行程天数"
      },
      {
        "value": "9 个",
        "label": "计划地点"
      },
      {
        "value": "¥2,800",
        "label": "人均预算"
      },
      {
        "value": "约 5,000 步/天",
        "label": "预计日均步数"
      },
      {
        "value": "7月·夏季",
        "label": "出行季节"
      }
    ]
  },
  "days": [
    {
      "day": 1,
      "theme": "DAY 1 · 渝中经典",
      "title": "解放碑 · 洪崖洞",
      "items": [
        {
          "time": "09:30",
          "poi": "解放碑步行街（抗战胜利纪功碑）",
          "note": "上午凉爽，步行街平坦好走，适合老人慢逛，打卡重庆地标"
        },
        {
          "time": "11:00",
          "poi": "重庆湖广会馆",
          "note": "室内有空调，避开中午暴晒，欣赏明清建筑与移民文化"
        },
        {
          "time": "12:30",
          "poi": "午餐：解放碑附近餐厅",
          "note": "就近用餐，减少老人步行疲劳"
        },
        {
          "time": "15:00",
          "poi": "长江索道（需提前在「重庆索道」公众号预约购票，单程¥20）",
          "note": "下午光线好，过江风景佳，索道单程仅4分钟，老人不累"
        },
        {
          "time": "18:30",
          "poi": "洪崖洞（夜景）",
          "note": "夏季19:30左右亮灯，傍晚去可先逛室内，天黑后看夜景，全程电梯可达各层"
        }
      ],
      "eat": "解放碑「老灶火锅」毛肚老火锅（微辣锅底，老人也能吃）"
    },
    {
      "day": 2,
      "theme": "DAY 2 · 古镇慢游",
      "title": "磁器口古镇 · 李子坝",
      "items": [
        {
          "time": "09:00",
          "poi": "磁器口古镇",
          "note": "上午游客少、气温未升，古镇主街平缓，老人可慢逛品尝小吃"
        },
        {
          "time": "11:30",
          "poi": "磁器口古镇内午餐",
          "note": "古镇内多家老字号，就近用餐不折腾"
        },
        {
          "time": "14:00",
          "poi": "李子坝轻轨站（观景平台看轻轨穿楼）",
          "note": "下午到观景平台只需步行几十米，拍完即走，不费体力"
        },
        {
          "time": "15:30",
          "poi": "鹅岭二厂文创园",
          "note": "室内文创空间有空调，可坐下喝茶休息，适合老人避暑"
        }
      ],
      "eat": "磁器口「陈麻花」总店·手工麻花（现烤香脆，可买伴手礼）"
    },
    {
      "day": 3,
      "theme": "DAY 3 · 南山休闲",
      "title": "南山一棵树 · 返程",
      "items": [
        {
          "time": "09:30",
          "poi": "重庆动物园（门票¥25，可在「重庆动物园」公众号购票）",
          "note": "上午动物活跃、气温适宜，园内可租电瓶车代步，老人不累"
        },
        {
          "time": "12:00",
          "poi": "动物园附近午餐",
          "note": "就近用餐，下午安排轻松"
        },
        {
          "time": "15:00",
          "poi": "南山一棵树观景台（门票¥30，可现场购票）",
          "note": "下午上山，观景台有电梯直达，俯瞰渝中半岛全景，夏季日落约19:30"
        }
      ],
      "eat": "南山「枇杷园火锅」· 山景火锅（露天庭院，傍晚凉风习习，微辣锅底适合全家）"
    }
  ],
  "budget": [
    {
      "label": "餐饮",
      "amount": 900,
      "percent": 32
    },
    {
      "label": "门票",
      "amount": 200,
      "percent": 7
    },
    {
      "label": "交通",
      "amount": 500,
      "percent": 18
    },
    {
      "label": "住宿",
      "amount": 1000,
      "percent": 36
    },
    {
      "label": "购物及其他",
      "amount": 200,
      "percent": 7
    }
  ],
  "checklist": [
    {
      "text": "身份证（老人携带身份证，部分景点可享优惠）",
      "done": false
    },
    {
      "text": "「重庆索道」公众号提前预约长江索道",
      "done": false
    },
    {
      "text": "「重庆动物园」公众号提前购票",
      "done": false
    },
    {
      "text": "遮阳帽、防晒霜、便携小风扇（7月重庆夏季高温）",
      "done": false
    },
    {
      "text": "舒适平底鞋（老人建议穿防滑软底鞋）",
      "done": false
    },
    {
      "text": "保温杯装凉水（随时补水防中暑）",
      "done": false
    },
    {
      "text": "下载「重庆轨道交通」App 或支付宝乘车码",
      "done": false
    },
    {
      "text": "藿香正气液等防暑药品",
      "done": false
    }
  ],
  "tips": [
    "7月重庆夏季炎热，建议随身携带藿香正气液和便携风扇",
    "洪崖洞亮灯时间约19:30，建议18:30前到，先逛室内再等夜景",
    "长江索道单程¥20，在「重庆索道」公众号预约可省排队时间",
    "重庆动物园可租电瓶车（¥30/小时），老人代步首选",
    "轨道交通用支付宝「出行」扫码即可，无需额外下载App",
    "⚠️ 「洪崖洞」未能在高德地图核实到在营状态，高德数据覆盖有限，建议出行前再确认"
  ],
  "schemaVersion": "1.0"
}